sample_name,sample_no,subspp,sex,measurer,collection,site,lat,lon,elev,sampling_date,sampling_year,sampling_month,sampling_day,sampling_yrday,gen_cycle
ANIC-14,14,Abeona,1,,ANIC,,-35.6288,150.323,28,22/03/1969,1969,3,22,81,-1
ANIC-16,16,Abeona,1,,ANIC,,-35.6262,150.2675,2,25/10/1956,1956,10,25,299,1
ANIC-17,17,Abeona,1,,ANIC,,-35.1279783,150.0678034,605,29/11/1962,1962,11,29,333,1
ANIC-18,18,Abeona,1,,ANIC,,-35.7162,150.1795,16,22/01/1963,1963,1,22,22,1
ANIC-20,20,Abeona,1,,ANIC,,-35.6982669,150.1692476,0,4/10/1969,1969,10,4,277,1
ANIC-21,21,Abeona,1,,ANIC,,-35.5459,149.9504,869,16/02/1962,1962,2,16,47,-1
ANIC-22,22,Abeona,1,,ANIC,,-35.1279783,150.0678034,605,29/11/1962,1962,11,29,333,1
ANIC-23,23,Abeona,1,,ANIC,,-35.6262,150.2675,2,25/10/1936,1936,10,25,299,1
ANIC-24,24,Abeona,1,,ANIC,,-35.8577,150.1882,30,28/02/1962,1962,2,28,59,-1
ANIC-25,25,Abeona,1,,ANIC,,-35.6288,150.323,28,22/03/1969,1969,3,22,81,-1
ANIC-26,26,Abeona,1,,ANIC,,-35.8667,150.1333,14,22/02/1969,1969,2,22,53,-1
ANIC-27,27,Abeona,1,,ANIC,,-35.6288,150.323,28,22/11/1969,1969,11,22,326,1
ANIC-28,28,Abeona,1,,ANIC,,-35.5754179,149.9892898,391,15/02/1962,1962,2,15,46,-1
ANIC-29,29,Abeona,1,,ANIC,,-35.564913,149.9783843,368,11/02/1955,1955,2,11,42,-1
ANIC-30,30,Abeona,1,,ANIC,,-35.5459,149.9504,869,16/02/1962,1962,2,16,47,-1
ANIC-31,31,Abeona,1,,ANIC,,-35.564913,149.9783843,368,11/02/1955,1955,2,11,42,-1
ANIC-32,32,Abeona,1,,ANIC,,-35.5459,149.9504,869,15/02/1962,1962,2,15,46,-1
ANIC-33,33,Abeona,1,,ANIC,,-35.5459,149.9504,869,15/02/1962,1962,2,15,46,-1
ANIC-34,34,Abeona,1,,ANIC,,-35.5459,149.9504,869,15/02/1962,1962,2,15,46,-1
ANIC-35,35,Abeona,1,,ANIC,,-35.5651611,149.9788303,359,18/01/1963,1963,1,18,18,1
ANIC-36,36,Abeona,1,,ANIC,,-35.5651611,149.9788303,359,18/01/1963,1963,1,18,18,1
ANIC-37,37,Abeona,1,,ANIC,,-35.1320883,150.7050486,52,13/09/1919,1919,9,13,256,1
ANIC-38,38,Abeona,1,,ANIC,,-35.5459,149.9504,869,15/02/1962,1962,2,15,46,-1
ANIC-39,39,Abeona,1,,ANIC,,-35.5651611,149.9788303,359,19/01/1968,1968,1,19,19,1
ANIC-40,40,Abeona,1,,ANIC,,-35.5459,149.9504,869,1/01/1966,1966,1,1,1,1
ANIC-41,41,Abeona,1,,ANIC,,-35.5459,149.9504,869,1/01/1966,1966,1,1,1,1
ANIC-42,42,Abeona,-1,,ANIC,,-35.5459,149.9504,869,1/01/1966,1966,1,1,1,1
ANIC-43,43,Abeona,1,,ANIC,,-35.835,150.2347,10,1/12/1977,1977,12,1,335,1
ANIC-47,47,Abeona,1,,ANIC,,-35.41425,149.538031,1143,10/02/1978,1978,2,10,41,-1
ANIC-48,48,Abeona,1,,ANIC,,-35.96,150.15,33,22/12/1983,1983,12,22,356,1
ANIC-49,49,Abeona,1,,ANIC,,-35.5459,149.9504,869,1/01/1966,1966,1,1,1,1
ANIC-50,50,Abeona,1,,ANIC,,-35.5298,149.9306,690,5/03/1983,1983,3,5,64,-1
ANIC-53,53,Abeona,-1,,ANIC,,-35.5459,149.9504,869,1/01/1966,1966,1,1,1,1
ANIC-54,54,Abeona,-1,,ANIC,,-35.0398,150.6707,13,26/11/1965,1965,11,26,330,1
ANIC-55,55,Abeona,-1,,ANIC,,-35.5651611,149.9788303,359,18/01/1963,1963,1,18,18,1
ANIC-56,56,Abeona,-1,,ANIC,,-35.1320883,150.7050486,52,12/10/1919,1919,10,12,285,1
ANIC-57,57,Abeona,1,,ANIC,,-35.0398,150.6707,13,18/12/1972,1972,12,18,353,1
ANIC-58,58,Albifascia,1,,ANIC,,-36.3062,150.0283,808,4/02/1969,1969,2,4,35,-1
ANIC-59,59,Albifascia,1,,ANIC,,-36.3062,150.0283,808,4/02/1969,1969,2,4,35,-1
ANIC-60,60,Albifascia,1,,ANIC,,-36.3062,150.0283,808,24/11/1965,1965,11,24,328,1
ANIC-61,61,Albifascia,1,,ANIC,,-36.3062,150.0283,808,4/02/1969,1969,2,4,35,-1
ANIC-62,62,Albifascia,1,,ANIC,,-36.5975,149.3843,1238,9/01/1968,1968,1,9,9,1
ANIC-63,63,Albifascia,1,,ANIC,,-36.5975,149.3843,1238,9/01/1968,1968,1,9,9,1
ANIC-64,64,Albifascia,1,,ANIC,,-36.5975,149.3843,1238,9/01/1968,1968,1,9,9,1
ANIC-65,65,Albifascia,1,,ANIC,,-36.5975,149.3843,1238,9/01/1968,1968,1,9,9,1
ANIC-66,66,Albifascia,1,,ANIC,,-36.5975,149.3843,1238,9/01/1968,1968,1,9,9,1
ANIC-67,67,Albifascia,1,,ANIC,,-36.3062,150.0283,808,28/12/1918,1918,12,28,362,1
ANIC-69,69,Albifascia,1,,ANIC,,-37.0137,149.9095,158,19/03/1960,1960,3,19,79,-1
ANIC-70,70,Albifascia,1,,ANIC,,-36.6743,149.8432,22,1/04/1973,1973,4,1,91,-1
ANIC-71,71,Albifascia,1,,ANIC,,-36.6743,149.8432,22,1/04/1973,1973,4,1,91,-1
ANIC-72,72,Albifascia,1,,ANIC,,-35.0398,150.6707,13,17/12/1972,1972,12,17,352,1
ANIC-73,73,Albifascia,1,,ANIC,,-35.0398,150.6707,13,17/12/1972,1972,12,17,352,1
ANIC-74,74,Albifascia,1,,ANIC,,-35.0398,150.6707,13,18/02/1972,1972,2,18,49,-1
ANIC-75,75,Albifascia,1,,ANIC,,-35.0398,150.6707,13,18/12/1972,1972,12,18,353,1
ANIC-76,76,Albifascia,1,,ANIC,,-35.0398,150.6707,13,19/12/1972,1972,12,19,354,1
ANIC-77,77,Albifascia,1,,ANIC,,-36.4273,150.0764,0,14/03/1951,1951,3,14,73,-1
ANIC-78,78,Albifascia,1,,ANIC,,-35.41425,149.538031,1143,10/02/1978,1978,2,10,41,-1
ANIC-79,79,Albifascia,1,,ANIC,,-35.41425,149.538031,1143,1/12/1977,1977,12,1,335,1
ANIC-80,80,Albifascia,1,,ANIC,,-35.41425,149.538031,1143,1/12/1977,1977,12,1,335,1
ANIC-81,81,Albifascia,1,,ANIC,,-35.41667,149.55,1130,16/02/1980,1980,2,16,47,-1
ANIC-83,83,Albifascia,1,,ANIC,,-36.3062,150.0283,808,20/12/1920,1920,12,20,355,1
ANIC-84,84,Albifascia,-1,,ANIC,,-36.5975,149.3843,1238,9/01/1968,1968,1,9,9,1
ANIC-85,85,Albifascia,-1,,ANIC,,-37.0137,149.9095,158,1/03/1960,1960,3,1,61,-1
ANIC-86,86,Albifascia,-1,,ANIC,,-36.5975,149.3843,1238,9/01/1968,1968,1,9,9,1
ANIC-87,87,Albifascia,0,,ANIC,,-35.41667,149.55,1130,12/02/1978,1978,2,12,43,-1
ANIC-88,88,Albifascia,-1,,ANIC,,-35.41667,149.55,1130,16/02/1980,1980,2,16,47,-1
ANIC-89,89,Albifascia,-1,,ANIC,,-35.41425,149.538031,1143,16/01/1978,1978,1,16,16,1
ANIC-90,90,Albifascia,-1,,ANIC,,-35.41667,149.55,1130,12/02/1978,1978,2,12,43,-1
ANIC-91,91,Albifascia,-1,,ANIC,,-35.41667,149.55,1130,12/02/1978,1978,2,12,43,-1
ANIC-92,92,Albifascia,-1,,ANIC,,-35.41667,149.55,1130,16/02/1980,1980,2,16,47,-1
ANIC-93,93,Albifascia,1,,ANIC,,-35.41667,149.55,1130,19/12/1981,1981,12,19,353,1
ANIC-94,94,Albifascia,1,,ANIC,,-36.8879,149.9064,18,18/03/1998,1998,3,18,77,-1
ANIC-95,95,Albifascia,1,,ANIC,,-35.41667,149.55,1130,26/12/1980,1980,12,26,361,1
ANIC-96,96,Albifascia,1,,ANIC,,-35.41425,149.538031,1143,1/12/1977,1977,12,1,335,1
ANIC-97,97,Albifascia,0,,ANIC,,-36.8598623,149.9253526,64,20/01/1996,1996,1,20,20,1
AUSM-10,10,,-1,JRC,AusMus,,-37.0647,149.906,52,14/02/1939,1939,2,14,45,-1
AUSM-100,100,Albifascia,1,JRC,AusMus,,-35.5608,150.3742,25,6/12/1967,1967,12,6,340,1
AUSM-101,101,Albifascia,1,JRC,AusMus,,-35.5608,150.3742,25,6/12/1967,1967,12,6,340,1
AUSM-102,102,Albifascia,1,JRC,AusMus,,-35.5608,150.3742,25,6/12/1967,1967,12,6,340,1
AUSM-103,103,Albifascia,1,JRC,AusMus,,-35.5608,150.3742,25,6/12/1967,1967,12,6,340,1
AUSM-104,104,Albifascia,1,JRC,AusMus,,-35.5608,150.3742,25,6/12/1967,1967,12,6,340,1
AUSM-105,105,Albifascia,0,JRC,AusMus,,-35.5608,150.3742,25,6/12/1967,1967,12,6,340,1
AUSM-106,106,Albifascia,1,JRC,AusMus,,-35.5608,150.3742,25,6/12/1967,1967,12,6,340,1
AUSM-107,107,Albifascia,1,JRC,AusMus,,-35.5608,150.3742,25,6/12/1967,1967,12,6,340,1
AUSM-108,108,Albifascia,1,JRC,AusMus,,-35.5608,150.3742,25,6/12/1967,1967,12,6,340,1
AUSM-109,109,Albifascia,1,JRC,AusMus,,-35.5608,150.3742,25,6/12/1967,1967,12,6,340,1
AUSM-11,11,,0,JRC,AusMus,,-37.0647,149.906,52,21/12/1914,1914,12,21,355,1
AUSM-110,110,Albifascia,1,JRC,AusMus,,-35.5608,150.3742,25,6/12/1967,1967,12,6,340,1
AUSM-111,111,Albifascia,1,JRC,AusMus,,-35.5608,150.3742,25,6/12/1967,1967,12,6,340,1
AUSM-112,112,Albifascia,1,JRC,AusMus,,-35.5608,150.3742,25,6/12/1967,1967,12,6,340,1
AUSM-113,113,Albifascia,1,JRC,AusMus,,-35.5608,150.3742,25,6/12/1967,1967,12,6,340,1
AUSM-114,114,Albifascia,0,JRC,AusMus,,-35.5608,150.3742,25,6/12/1967,1967,12,6,340,1
AUSM-115,115,Albifascia,1,JRC,AusMus,,-35.5608,150.3742,25,6/12/1967,1967,12,6,340,1
AUSM-116,116,Albifascia,1,JRC,AusMus,,-35.5608,150.3742,25,6/12/1967,1967,12,6,340,1
AUSM-117,117,Albifascia,1,JRC,AusMus,,-35.5608,150.3742,25,6/12/1967,1967,12,6,340,1
AUSM-118,118,Albifascia,1,JRC,AusMus,,-35.5608,150.3742,25,6/12/1967,1967,12,6,340,1
AUSM-119,119,Albifascia,-1,JRC,AusMus,,-35.5608,150.3742,25,6/12/1967,1967,12,6,340,1
AUSM-12,12,,1,JRC,AusMus,,-37.010829,149.888715,315,13/11/1914,1914,11,13,317,1
AUSM-120,120,Albifascia,-1,JRC,AusMus,,-35.5608,150.3742,25,6/12/1967,1967,12,6,340,1
AUSM-121,121,Albifascia,0,JRC,AusMus,,-35.5608,150.3742,25,23/03/1968,1968,3,23,83,-1
AUSM-122,122,Albifascia,1,JRC,AusMus,,-36.8879,149.9064,18,27/01/1970,1970,1,27,27,1
AUSM-123,123,Albifascia,1,JRC,AusMus,,-36.8879,149.9064,18,27/01/1970,1970,1,27,27,1
AUSM-124,124,Albifascia,1,JRC,AusMus,,-36.8879,149.9064,18,27/01/1970,1970,1,27,27,1
AUSM-125,125,Albifascia,1,JRC,AusMus,,-36.8879,149.9064,18,27/01/1970,1970,1,27,27,1
AUSM-126,126,Albifascia,1,JRC,AusMus,,-36.8879,149.9064,18,27/01/1970,1970,1,27,27,1
AUSM-127,127,Albifascia,1,JRC,AusMus,,-36.8879,149.9064,18,27/01/1970,1970,1,27,27,1
AUSM-128,128,Albifascia,-1,JRC,AusMus,,-36.8879,149.9064,18,27/01/1970,1970,1,27,27,1
AUSM-129,129,Albifascia,1,JRC,AusMus,,-36.8879,149.9064,18,27/01/1970,1970,1,27,27,1
AUSM-13,13,,0,JRC,AusMus,,-36.4272,150.0764,0,10/11/1914,1914,11,10,314,1
AUSM-130,130,Albifascia,1,JRC,AusMus,,-36.1000271,150.124948,52,7/12/1967,1967,12,7,341,1
AUSM-131,131,Albifascia,1,JRC,AusMus,,-36.1000271,150.124948,52,8/12/1967,1967,12,8,342,1
AUSM-132,132,Albifascia,1,JRC,AusMus,,-36.1000271,150.124948,52,9/12/1967,1967,12,9,343,1
AUSM-133,133,Albifascia,1,JRC,AusMus,,-36.1000271,150.124948,52,10/12/1967,1967,12,10,344,1
AUSM-134,134,Albifascia,1,JRC,AusMus,,-36.1000271,150.124948,52,11/12/1967,1967,12,11,345,1
AUSM-135,135,Albifascia,1,JRC,AusMus,,-37.2544,149.9069,71,12/12/1969,1969,12,12,346,1
AUSM-136,136,Albifascia,1,JRC,AusMus,,-37.2544,149.9069,71,27/01/1970,1970,1,27,27,1
AUSM-137,137,Albifascia,1,JRC,AusMus,,-37.2544,149.9069,71,27/01/1970,1970,1,27,27,1
AUSM-138,138,Albifascia,1,JRC,AusMus,,-37.2544,149.9069,71,27/01/1970,1970,1,27,27,1
AUSM-139,139,Albifascia,1,JRC,AusMus,,-37.2544,149.9069,71,27/01/1970,1970,1,27,27,1
AUSM-140,140,Albifascia,1,JRC,AusMus,,-37.2544,149.9069,71,27/01/1970,1970,1,27,27,1
AUSM-141,141,Albifascia,1,JRC,AusMus,,-37.2544,149.9069,71,27/01/1970,1970,1,27,27,1
AUSM-142,142,Albifascia,1,JRC,AusMus,,-37.2544,149.9069,71,27/01/1970,1970,1,27,27,1
AUSM-143,143,Albifascia,1,JRC,AusMus,,-37.2544,149.9069,71,27/01/1970,1970,1,27,27,1
AUSM-144,144,Albifascia,1,JRC,AusMus,,-37.2544,149.9069,71,27/01/1970,1970,1,27,27,1
AUSM-145,145,Albifascia,1,JRC,AusMus,,-37.2544,149.9069,71,27/01/1970,1970,1,27,27,1
AUSM-146,146,Albifascia,1,JRC,AusMus,,-37.2544,149.9069,71,27/01/1970,1970,1,27,27,1
AUSM-147,147,Abeona,1,JRC,AusMus,,-35.486322,150.335237,41,6/12/1967,1967,12,6,340,1
AUSM-148,148,Abeona,1,JRC,AusMus,,-35.486322,150.335237,41,6/12/1967,1967,12,6,340,1
AUSM-149,149,Abeona,1,JRC,AusMus,,-35.486322,150.335237,41,6/12/1967,1967,12,6,340,1
AUSM-15,15,,1,JRC,AusMus,,-36.581521,149.394949,1070,25/12/1974,1974,12,25,359,1
AUSM-150,150,Abeona,1,JRC,AusMus,,-35.486322,150.335237,41,6/12/1967,1967,12,6,340,1
AUSM-151,151,Abeona,1,JRC,AusMus,,-35.486322,150.335237,41,6/12/1967,1967,12,6,340,1
AUSM-152,152,Abeona,-1,JRC,AusMus,,-35.486322,150.335237,41,6/12/1967,1967,12,6,340,1
AUSM-153,153,Abeona,1,JRC,AusMus,,-35.486322,150.335237,41,6/12/1967,1967,12,6,340,1
AUSM-154,154,Abeona,1,JRC,AusMus,,-35.486322,150.335237,41,6/12/1967,1967,12,6,340,1
AUSM-155,155,Abeona,1,JRC,AusMus,,-35.486322,150.335237,41,6/12/1967,1967,12,6,340,1
AUSM-156,156,Abeona,1,JRC,AusMus,,-35.486322,150.335237,41,6/12/1967,1967,12,6,340,1
AUSM-157,157,Abeona,1,JRC,AusMus,,-35.486322,150.335237,41,6/12/1967,1967,12,6,340,1
AUSM-158,158,Abeona,-1,JRC,AusMus,,-35.486322,150.335237,41,6/12/1967,1967,12,6,340,1
AUSM-159,159,Abeona,-1,JRC,AusMus,,-35.486322,150.335237,41,6/12/1967,1967,12,6,340,1
AUSM-16,16,,1,JRC,AusMus,,-36.581521,149.394949,1070,25/12/1974,1974,12,25,359,1
AUSM-160,160,Abeona,-1,JRC,AusMus,,-35.486322,150.335237,41,6/12/1967,1967,12,6,340,1
AUSM-161,161,Abeona,1,JRC,AusMus,,-35.3572,150.4613,66,4/12/1967,1967,12,4,338,1
AUSM-162,162,Abeona,1,JRC,AusMus,,-35.3572,150.4613,66,4/12/1967,1967,12,4,338,1
AUSM-163,163,Abeona,1,JRC,AusMus,,-35.3572,150.4613,66,4/12/1967,1967,12,4,338,1
AUSM-164,164,Abeona,1,JRC,AusMus,,-35.3572,150.4613,66,4/12/1967,1967,12,4,338,1
AUSM-165,165,Abeona,1,JRC,AusMus,,-35.3572,150.4613,66,4/12/1967,1967,12,4,338,1
AUSM-166,166,Abeona,1,JRC,AusMus,,-35.3572,150.4613,66,4/12/1967,1967,12,4,338,1
AUSM-167,167,Abeona,1,JRC,AusMus,,-35.3572,150.4613,66,4/12/1967,1967,12,4,338,1
AUSM-168,168,Abeona,1,JRC,AusMus,,-35.3572,150.4613,66,4/12/1967,1967,12,4,338,1
AUSM-169,169,Abeona,1,JRC,AusMus,,-35.3572,150.4613,66,4/12/1967,1967,12,4,338,1
AUSM-17,17,,1,JRC,AusMus,,-35.3572,150.4613,66,28/10/1914,1914,10,28,301,1
AUSM-170,170,Abeona,0,JRC,AusMus,,-35.3572,150.4613,66,22/03/1968,1968,3,22,82,-1
AUSM-171,171,Abeona,0,JRC,AusMus,,-35.3572,150.4613,66,22/03/1968,1968,3,22,82,-1
AUSM-172,172,Abeona,0,JRC,AusMus,,-35.3572,150.4613,66,22/03/1968,1968,3,22,82,-1
AUSM-173,173,Abeona,0,JRC,AusMus,,-35.3572,150.4613,66,22/03/1968,1968,3,22,82,-1
AUSM-18,18,,0,JRC,AusMus,,-35.5608,150.3742,25,6/11/1914,1914,11,6,310,1
AUSM-19,19,Abeona,1,JRC,AusMus,,-35.3889,150.4441,10,4/12/1967,1967,12,4,338,1
AUSM-2,2,,1,JRC,AusMus,,-37.0647,149.906,52,14/02/1939,1939,2,14,45,-1
AUSM-20,20,Abeona,1,JRC,AusMus,,-35.3889,150.4441,10,4/12/1967,1967,12,4,338,1
AUSM-21,21,Abeona,1,JRC,AusMus,,-35.3889,150.4441,10,4/12/1967,1967,12,4,338,1
AUSM-22,22,Abeona,1,JRC,AusMus,,-35.3889,150.4441,10,4/12/1967,1967,12,4,338,1
AUSM-23,23,Abeona,1,JRC,AusMus,,-35.3889,150.4441,10,4/12/1967,1967,12,4,338,1
AUSM-24,24,Abeona,1,JRC,AusMus,,-35.3889,150.4441,10,4/12/1967,1967,12,4,338,1
AUSM-25,25,Abeona,1,JRC,AusMus,,-35.3889,150.4441,10,4/12/1967,1967,12,4,338,1
AUSM-26,26,Abeona,-1,JRC,AusMus,,-35.3889,150.4441,10,4/12/1967,1967,12,4,338,1
AUSM-27,27,Abeona,0,JRC,AusMus,,-35.3889,150.4441,10,27/03/1968,1968,3,27,87,-1
AUSM-28,28,Albifascia,0,JRC,AusMus,,-36.5975,149.3843,1238,22/01/1970,1970,1,22,22,1
AUSM-29,29,Albifascia,1,JRC,AusMus,,-36.5975,149.3843,1238,22/01/1970,1970,1,22,22,1
AUSM-3,3,,1,JRC,AusMus,,-37.010829,149.888715,315,13/11/1914,1914,11,13,317,1
AUSM-30,30,Albifascia,1,JRC,AusMus,,-36.5975,149.3843,1238,22/01/1970,1970,1,22,22,1
AUSM-31,31,Albifascia,1,JRC,AusMus,,-36.5975,149.3843,1238,22/01/1970,1970,1,22,22,1
AUSM-32,32,Albifascia,1,JRC,AusMus,,-36.5975,149.3843,1238,22/01/1970,1970,1,22,22,1
AUSM-33,33,Albifascia,1,JRC,AusMus,,-36.5975,149.3843,1238,22/01/1970,1970,1,22,22,1
AUSM-34,34,Albifascia,1,JRC,AusMus,,-36.5975,149.3843,1238,22/01/1970,1970,1,22,22,1
AUSM-35,35,Albifascia,1,JRC,AusMus,,-36.5975,149.3843,1238,22/01/1970,1970,1,22,22,1
AUSM-36,36,Albifascia,1,JRC,AusMus,,-36.5975,149.3843,1238,22/01/1970,1970,1,22,22,1
AUSM-37,37,Albifascia,1,JRC,AusMus,,-36.5975,149.3843,1238,22/01/1970,1970,1,22,22,1
AUSM-38,38,Albifascia,1,JRC,AusMus,,-36.5975,149.3843,1238,22/01/1970,1970,1,22,22,1
AUSM-39,39,Albifascia,0,JRC,AusMus,,-36.5975,149.3843,1238,22/01/1970,1970,1,22,22,1
AUSM-4,4,,1,JRC,AusMus,,-37.010829,149.888715,315,14/11/1914,1914,11,14,318,1
AUSM-40,40,Albifascia,-1,JRC,AusMus,,-36.5975,149.3843,1238,22/01/1970,1970,1,22,22,1
AUSM-41,41,Albifascia,1,JRC,AusMus,,-36.5975,149.3843,1238,22/01/1970,1970,1,22,22,1
AUSM-42,42,Albifascia,1,JRC,AusMus,,-36.5975,149.3843,1238,22/01/1979,1979,1,22,22,1
AUSM-43,43,Albifascia,1,JRC,AusMus,,-36.5975,149.3843,1238,22/01/1979,1979,1,22,22,1
AUSM-44,44,Albifascia,1,JRC,AusMus,,-36.5975,149.3843,1238,22/01/1979,1979,1,22,22,1
AUSM-45,45,Albifascia,1,JRC,AusMus,,-36.5975,149.3843,1238,22/01/1979,1979,1,22,22,1
AUSM-46,46,Albifascia,1,JRC,AusMus,,-36.5975,149.3843,1238,22/01/1979,1979,1,22,22,1
AUSM-47,47,Albifascia,1,JRC,AusMus,,-36.5975,149.3843,1238,22/01/1979,1979,1,22,22,1
AUSM-48,48,Albifascia,1,JRC,AusMus,,-36.5975,149.3843,1238,22/01/1979,1979,1,22,22,1
AUSM-49,49,Albifascia,1,JRC,AusMus,,-36.5975,149.3843,1238,22/01/1979,1979,1,22,22,1
AUSM-5,5,,1,JRC,AusMus,,-37.010829,149.888715,315,15/11/1914,1914,11,15,319,1
AUSM-50,50,Albifascia,1,JRC,AusMus,,-36.5975,149.3843,1238,22/01/1979,1979,1,22,22,1
AUSM-51,51,Albifascia,1,JRC,AusMus,,-36.5975,149.3843,1238,22/01/1979,1979,1,22,22,1
AUSM-52,52,Albifascia,1,JRC,AusMus,,-36.5975,149.3843,1238,22/01/1979,1979,1,22,22,1
AUSM-53,53,Albifascia,1,JRC,AusMus,,-36.5975,149.3843,1238,22/01/1979,1979,1,22,22,1
AUSM-54,54,Albifascia,1,JRC,AusMus,,-36.5975,149.3843,1238,22/01/1979,1979,1,22,22,1
AUSM-55,55,Albifascia,-1,JRC,AusMus,,-36.5975,149.3843,1238,22/01/1979,1979,1,22,22,1
AUSM-56,56,Albifascia,0,JRC,AusMus,,-35.83475,150.081307,182,7/12/1967,1967,12,7,341,1
AUSM-57,57,Albifascia,1,JRC,AusMus,,-35.855,150.1747,10,7/12/1967,1967,12,7,341,1
AUSM-58,58,Albifascia,1,JRC,AusMus,,-35.855,150.1747,10,7/12/1967,1967,12,7,341,1
AUSM-59,59,Albifascia,1,JRC,AusMus,,-35.855,150.1747,10,7/12/1967,1967,12,7,341,1
AUSM-6,6,,1,JRC,AusMus,,-37.010829,149.888715,315,16/11/1914,1914,11,16,320,1
AUSM-60,60,Albifascia,1,JRC,AusMus,,-35.855,150.1747,10,7/12/1967,1967,12,7,341,1
AUSM-61,61,Albifascia,1,JRC,AusMus,,-35.855,150.1747,10,7/12/1967,1967,12,7,341,1
AUSM-62,62,Albifascia,1,JRC,AusMus,,-35.855,150.1747,10,7/12/1967,1967,12,7,341,1
AUSM-63,63,Albifascia,1,JRC,AusMus,,-35.855,150.1747,10,7/12/1967,1967,12,7,341,1
AUSM-64,64,Albifascia,1,JRC,AusMus,,-35.855,150.1747,10,7/12/1967,1967,12,7,341,1
AUSM-65,65,Albifascia,1,JRC,AusMus,,-35.855,150.1747,10,7/12/1967,1967,12,7,341,1
AUSM-66,66,Albifascia,-1,JRC,AusMus,,-35.855,150.1747,10,7/12/1967,1967,12,7,341,1
AUSM-67,67,Albifascia,1,JRC,AusMus,,-35.855,150.1747,10,7/12/1967,1967,12,7,341,1
AUSM-68,68,Albifascia,-1,JRC,AusMus,,-35.855,150.1747,10,7/12/1967,1967,12,7,341,1
AUSM-69,69,Albifascia,-1,JRC,AusMus,,-35.855,150.1747,10,7/12/1967,1967,12,7,341,1
AUSM-70,70,Albifascia,1,JRC,AusMus,,-35.6808,150.17722,62,6/12/1967,1967,12,6,340,1
AUSM-71,71,Albifascia,1,JRC,AusMus,,-35.6808,150.17722,62,6/12/1967,1967,12,6,340,1
AUSM-72,72,Albifascia,1,JRC,AusMus,,-35.6808,150.17722,62,6/12/1967,1967,12,6,340,1
AUSM-73,73,Albifascia,1,JRC,AusMus,,-35.6808,150.17722,62,6/12/1967,1967,12,6,340,1
AUSM-74,74,Albifascia,1,JRC,AusMus,,-35.6808,150.17722,62,8/12/1967,1967,12,8,342,1
AUSM-75,75,Albifascia,1,JRC,AusMus,,-35.6808,150.17722,62,8/12/1967,1967,12,8,342,1
AUSM-76,76,Albifascia,1,JRC,AusMus,,-35.6808,150.17722,62,8/12/1967,1967,12,8,342,1
AUSM-77,77,Albifascia,-1,JRC,AusMus,,-35.6808,150.17722,62,8/12/1967,1967,12,8,342,1
AUSM-78,78,Albifascia,-1,JRC,AusMus,,-35.6808,150.17722,62,8/12/1967,1967,12,8,342,1
AUSM-79,79,Albifascia,1,JRC,AusMus,,-35.6808,150.17722,62,8/12/1967,1967,12,8,342,1
AUSM-8,8,,0,JRC,AusMus,,-36.7297,149.9858,49,14/11/1914,1914,11,14,318,1
AUSM-80,80,Albifascia,1,JRC,AusMus,,-35.6808,150.17722,62,8/12/1967,1967,12,8,342,1
AUSM-81,81,Albifascia,1,JRC,AusMus,,-35.5459,149.9504,869,26/01/1970,1970,1,26,26,1
AUSM-82,82,Albifascia,1,JRC,AusMus,,-35.5459,149.9504,869,26/01/1970,1970,1,26,26,1
AUSM-83,83,Albifascia,1,JRC,AusMus,,-35.5459,149.9504,869,26/01/1970,1970,1,26,26,1
AUSM-84,84,Albifascia,1,JRC,AusMus,,-35.5459,149.9504,869,26/01/1970,1970,1,26,26,1
AUSM-85,85,Albifascia,1,JRC,AusMus,,-35.5459,149.9504,869,26/01/1970,1970,1,26,26,1
AUSM-86,86,Albifascia,1,JRC,AusMus,,-35.5459,149.9504,869,26/01/1970,1970,1,26,26,1
AUSM-87,87,Albifascia,-1,JRC,AusMus,,-35.5459,149.9504,869,26/01/1970,1970,1,26,26,1
AUSM-88,88,Albifascia,-1,JRC,AusMus,,-35.5459,149.9504,869,26/01/1970,1970,1,26,26,1
AUSM-89,89,Albifascia,1,JRC,AusMus,,-36.976944,149.90583,8,7/12/1967,1967,12,7,341,1
AUSM-90,90,Albifascia,1,JRC,AusMus,,-36.976944,149.90583,8,8/12/1967,1967,12,8,342,1
AUSM-91,91,Albifascia,1,JRC,AusMus,,-36.976944,149.90583,8,9/12/1967,1967,12,9,343,1
AUSM-92,92,Albifascia,1,JRC,AusMus,,-36.976944,149.90583,8,10/12/1967,1967,12,10,344,1
AUSM-93,93,Albifascia,1,JRC,AusMus,,-36.976944,149.90583,8,27/01/1970,1970,1,27,27,1
AUSM-94,94,Albifascia,1,JRC,AusMus,,-36.976944,149.90583,8,27/01/1970,1970,1,27,27,1
AUSM-95,95,Albifascia,1,JRC,AusMus,,-36.976944,149.90583,8,27/01/1970,1970,1,27,27,1
AUSM-96,96,Albifascia,1,JRC,AusMus,,-36.976944,149.90583,8,27/01/1970,1970,1,27,27,1
AUSM-97,97,Albifascia,1,JRC,AusMus,,-36.976944,149.90583,8,27/01/1970,1970,1,27,27,1
AUSM-98,98,Albifascia,-1,JRC,AusMus,,-36.976944,149.90583,8,27/01/1970,1970,1,27,27,1
AUSM-99,99,Albifascia,-1,JRC,AusMus,,-36.976944,149.90583,8,27/01/1970,1970,1,27,27,1
LB-11,11,,1,,LB,7,-35.94833333,150.1372222,15,19/01/2002,2002,1,19,19,1
LB-12,12,,1,,LB,7,-35.94833333,150.1372222,15,19/01/2002,2002,1,19,19,1
LB-13,13,,0,,LB,14,-35.55555556,150.3366667,122,19/01/2002,2002,1,19,19,1
LB-14,14,,1,,LB,4,-36.69497222,149.9791389,34,21/01/2002,2002,1,21,21,1
LB-15,15,,1,,LB,4,-36.69497222,149.9791389,34,21/01/2002,2002,1,21,21,1
LB-16,16,,1,,LB,4,-36.69497222,149.9791389,34,21/01/2002,2002,1,21,21,1
LB-18,18,,1,,LB,3,-36.86833333,149.8408333,98,22/01/2002,2002,1,22,22,1
LB-19,19,,1,,LB,3,-36.86833333,149.8408333,98,22/01/2002,2002,1,22,22,1
LB-2,2,,1,,LB,9,-35.78511111,150.1577778,127,15/01/2002,2002,1,15,15,1
LB-21,21,,1,,LB,12,-35.55813889,150.3560556,139,23/01/2002,2002,1,23,23,1
LB-22,22,,-1,,LB,12,-35.55813889,150.3560556,139,23/01/2002,2002,1,23,23,1
LB-23,23,,-1,,LB,12,-35.55813889,150.3560556,139,23/01/2002,2002,1,23,23,1
LB-24,24,,-1,,LB,3,-36.87416667,149.8369444,101,26/01/2002,2002,1,26,26,1
LB-25,25,,1,,LB,3,-36.87416667,149.8369444,101,26/01/2002,2002,1,26,26,1
LB-27,27,,1,,LB,3,-36.86833333,149.8408333,98,26/01/2002,2002,1,26,26,1
LB-28,28,,0,,LB,2,-37.18333333,149.9,169,27/01/2002,2002,1,27,27,1
LB-3,3,,1,,LB,9,-35.78511111,150.1577778,127,15/01/2002,2002,1,15,15,1
LB-30,30,,1,,LB,2,-37.11666667,149.85,65,27/01/2002,2002,1,27,27,1
LB-31,31,,1,,LB,11,-35.56055556,150.3547222,135,2/12/2002,2002,12,2,336,1
LB-32,32,,1,,LB,10,-35.62026,150.28903,122,3/12/2002,2002,12,3,337,1
LB-34,34,,1,,LB,10,-35.62026,150.28903,122,3/12/2002,2002,12,3,337,1
LB-36,36,,1,,LB,13,-35.55655,150.26063,107,3/12/2002,2002,12,3,337,1
LB-38,38,,0,,LB,13,-35.55655,150.26063,107,3/12/2002,2002,12,3,337,1
LB-39,39,,0,,LB,8,-35.86642,150.11846,17,4/12/2002,2002,12,4,338,1
LB-4,4,,1,,LB,9,-35.78511111,150.1577778,127,15/01/2002,2002,1,15,15,1
LB-40,40,,-1,,LB,8,-35.86642,150.11846,17,4/12/2002,2002,12,4,338,1
LB-41,41,,1,,LB,8,-35.86642,150.11846,17,4/12/2002,2002,12,4,338,1
LB-42,42,,0,,LB,8,-35.86642,150.11846,17,4/12/2002,2002,12,4,338,1
LB-43,43,,1,,LB,8,-35.86642,150.11846,17,4/12/2002,2002,12,4,338,1
LB-44,44,,1,,LB,6,-36.1355,150.05015,87,5/12/2002,2002,12,5,339,1
LB-45,45,,1,,LB,6,-36.1355,150.05015,87,5/12/2002,2002,12,5,339,1
LB-46,46,,1,,LB,6,-36.1355,150.05015,87,5/12/2002,2002,12,5,339,1
LB-47,47,,1,,LB,6,-36.1355,150.05015,87,5/12/2002,2002,12,5,339,1
LB-48,48,,1,,LB,2,-36.97614,149.92142,23,7/12/2002,2002,12,7,341,1
LB-49,49,,1,,LB,2,-36.97614,149.92142,23,7/12/2002,2002,12,7,341,1
LB-5,5,,1,,LB,9,-35.78511111,150.1577778,127,15/01/2002,2002,1,15,15,1
LB-50,50,,1,,LB,2,-36.97614,149.92142,23,7/12/2002,2002,12,7,341,1
LB-51,51,,1,,LB,2,-36.97614,149.92142,23,7/12/2002,2002,12,7,341,1
LB-52,52,,1,,LB,2,-36.97614,149.92142,23,7/12/2002,2002,12,7,341,1
LB-53,53,,-1,,LB,2,-36.97614,149.92142,23,7/12/2002,2002,12,7,341,1
LB-54,54,,1,,LB,2,-36.97614,149.92142,23,7/12/2002,2002,12,7,341,1
LB-55,55,,1,,LB,2,-36.97614,149.92142,23,7/12/2002,2002,12,7,341,1
LB-56,56,,1,,LB,2,-36.97614,149.92142,23,7/12/2002,2002,12,7,341,1
LB-57,57,,1,,LB,2,-36.97614,149.92142,23,7/12/2002,2002,12,7,341,1
LB-58,58,,1,,LB,2,-36.97614,149.92142,23,7/12/2002,2002,12,7,341,1
LB-59,59,,1,,LB,2,-36.97614,149.92142,23,7/12/2002,2002,12,7,341,1
LB-60,60,,0,,LB,1,-37.38726,149.72326,54,8/12/2002,2002,12,8,342,1
LB-61,61,,1,,LB,1,-37.38726,149.72326,54,8/12/2002,2002,12,8,342,1
LB-62,62,,1,,LB,1,-37.38726,149.72326,54,8/12/2002,2002,12,8,342,1
LB-64,64,,-1,,LB,1,-37.29395,149.82248,103,8/12/2002,2002,12,8,342,1
LB-65,65,,1,,LB,1,-37.28495,149.79368,160,8/12/2002,2002,12,8,342,1
LB-66,66,,1,,LB,1,-37.28495,149.79368,160,8/12/2002,2002,12,8,342,1
LB-67,67,,1,,LB,1,-37.28495,149.79368,160,8/12/2002,2002,12,8,342,1
LB-68,68,,1,,LB,2,-37.13314,149.86732,67,8/12/2002,2002,12,8,342,1
LB-69,69,,1,,LB,2,-37.13314,149.86732,67,9/12/2002,2002,12,9,343,1
LB-7,7,,1,,LB,9,-35.78511111,150.1577778,127,17/01/2002,2002,1,17,17,1
LB-70,70,,1,,LB,5,-36.48334,149.97878,157,10/12/2002,2002,12,10,344,1
LB-72,72,,1,,LB,5,-36.48334,149.97878,157,10/12/2002,2002,12,10,344,1
LB-73,73,,0,,LB,5,-36.48334,149.97878,157,10/12/2002,2002,12,10,344,1
LB-74,74,,1,,LB,5,-36.48334,149.97878,157,10/12/2002,2002,12,10,344,1
LB-75,75,,1,,LB,5,-36.48334,149.97878,157,10/12/2002,2002,12,10,344,1
LB-8,8,,1,,LB,9,-35.78511111,150.1577778,127,17/01/2002,2002,1,17,17,1
LB-9,9,,1,,LB,9,-35.78511111,150.1577778,127,17/01/2002,2002,1,17,17,1
MCV-1,1,abeona,1,#VALUE!,MCV,2,-35.56115,150.36623,62,21/01/2022,2022,1,21,21,1
MCV-10,10,?,1,#VALUE!,MCV,NA5,-36.13089,150.05513,69,24/01/2022,2022,1,24,24,1
MCV-100,100,,1,1,MCV,6,-36.4627337,150.0092702,144,24/01/2022,2022,1,24,24,1
MCV-101,101,,-1,2,MCV,6,-36.4627337,150.0092702,144,24/01/2022,2022,1,24,24,1
MCV-102,102,,1,1,MCV,6,-36.4627337,150.0092702,144,24/01/2022,2022,1,24,24,1
MCV-103,103,,1,2,MCV,6,-36.4627337,150.0092702,144,24/01/2022,2022,1,24,24,1
MCV-104,104,,1,1,MCV,6,-36.4627337,150.0092702,144,24/01/2022,2022,1,24,24,1
MCV-105,105,,1,2,MCV,6,-36.4627337,150.0092702,144,24/01/2022,2022,1,24,24,1
MCV-106,106,,1,1,MCV,9,-37.1134174,149.9507169,67,25/02/2022,2022,2,25,56,-1
MCV-107,107,,1,2,MCV,9,-37.1134174,149.9507169,67,25/02/2022,2022,2,25,56,-1
MCV-108,108,,1,1,MCV,4,-36.0225142,150.0853651,76,26/02/2022,2022,2,26,57,-1
MCV-109,109,,1,2,MCV,NA3,-35.86537584,150.1195177,14,26/02/2022,2022,2,26,57,-1
MCV-11,11,?,1,#VALUE!,MCV,NA5,-36.16981,150.01455,199,24/01/2022,2022,1,24,24,1
MCV-110,110,,1,1,MCV,4,-36.0225142,150.0853651,76,27/02/2022,2022,2,27,58,-1
MCV-111,111,,1,2,MCV,4,-36.0225142,150.0853651,76,27/02/2022,2022,2,27,58,-1
MCV-112,112,,1,1,MCV,3,-35.6817543,150.1631954,146,27/02/2022,2022,2,27,58,-1
MCV-113,113,,1,2,MCV,3,-35.6817543,150.1631954,146,27/02/2022,2022,2,27,58,-1
MCV-114,114,,1,1,MCV,3,-35.6817543,150.1631954,146,27/02/2022,2022,2,27,58,-1
MCV-115,115,,1,2,MCV,3,-35.6817543,150.1631954,146,27/02/2022,2022,2,27,58,-1
MCV-116,116,,1,1,MCV,3,-35.6817543,150.1631954,146,27/02/2022,2022,2,27,58,-1
MCV-117,117,,1,2,MCV,3,-35.6817543,150.1631954,146,27/02/2022,2022,2,27,58,-1
MCV-118,118,,1,1,MCV,1,-35.4368541,150.3758587,96,27/02/2022,2022,2,27,58,-1
MCV-119,119,,1,2,MCV,1,-35.4368541,150.3758587,96,27/02/2022,2022,2,27,58,-1
MCV-12,12,abeona,1,#VALUE!,MCV,7,-36.68924,149.98441,60,25/01/2022,2022,1,25,25,1
MCV-120,120,,1,1,MCV,1,-35.4368541,150.3758587,96,27/02/2022,2022,2,27,58,-1
MCV-121,121,,1,2,MCV,1,-35.4368541,150.3758587,96,27/02/2022,2022,2,27,58,-1
MCV-13,13,abeona,1,#VALUE!,MCV,7,-36.6920198,149.99065,48,25/01/2022,2022,1,25,25,1
MCV-14,14,?,1,#VALUE!,MCV,7,-36.6920198,149.99065,48,25/01/2022,2022,1,25,25,1
MCV-15,15,albifascia,-1,#VALUE!,MCV,5,-36.144591,150.0741538,70,26/01/2022,2022,1,26,26,1
MCV-16,16,abeona,1,#VALUE!,MCV,5,-36.1435983,150.0717626,59,26/01/2022,2022,1,26,26,1
MCV-17,17,albifascia,-1,#VALUE!,MCV,5,-36.1435983,150.0717626,59,26/01/2022,2022,1,26,26,1
MCV-18,18,abeona,1,#VALUE!,MCV,5,-36.1435983,150.0717626,59,26/01/2022,2022,1,26,26,1
MCV-19,19,abeona,1,#VALUE!,MCV,5,-36.1435983,150.0717626,59,26/01/2022,2022,1,26,26,1
MCV-2,2,abeona,1,#VALUE!,MCV,2,-35.56004,150.36372,76,21/01/2022,2022,1,21,21,1
MCV-20,20,abeona,1,#VALUE!,MCV,5,-36.144591,150.0741538,70,26/01/2022,2022,1,26,26,1
MCV-21,21,?,1,#VALUE!,MCV,5,-36.144591,150.0741538,70,26/01/2022,2022,1,26,26,1
MCV-22,22,albifascia,1,#VALUE!,MCV,5,-36.144591,150.0741538,70,26/01/2022,2022,1,26,26,1
MCV-23,23,albifascia,1,#VALUE!,MCV,5,-36.1508096,150.0743694,77,26/01/2022,2022,1,26,26,1
MCV-24,24,,1,#VALUE!,MCV,5,-36.1508096,150.0743694,77,26/01/2022,2022,1,26,26,1
MCV-25,25,,1,#VALUE!,MCV,NA5,-36.1287281,150.0696038,56,26/01/2022,2022,1,26,26,1
MCV-26,26,,1,#VALUE!,MCV,NA5,-36.1287281,150.0696038,56,26/01/2022,2022,1,26,26,1
MCV-27,27,,1,#VALUE!,MCV,NA5,-36.1287281,150.0696038,56,26/01/2022,2022,1,26,26,1
MCV-28,28,,1,#VALUE!,MCV,NA5,-36.129865,150.0647681,63,26/01/2022,2022,1,26,26,1
MCV-29,29,,1,#VALUE!,MCV,NA5,-36.1362412,150.0484177,97,26/01/2022,2022,1,26,26,1
MCV-3,3,abeona,1,#VALUE!,MCV,NA2,-35.596096,150.299652,103,22/01/2022,2022,1,22,22,1
MCV-30,30,,1,#VALUE!,MCV,NA5,-36.1362412,150.0484177,97,26/01/2022,2022,1,26,26,1
MCV-31,31,,1,#VALUE!,MCV,NA5,-36.1362412,150.0484177,97,26/01/2022,2022,1,26,26,1
MCV-32,32,,1,#VALUE!,MCV,8,-36.9740505,149.921774,31,27/01/2022,2022,1,27,27,1
MCV-33,33,,1,#VALUE!,MCV,8,-36.9740505,149.921774,31,27/01/2022,2022,1,27,27,1
MCV-34,34,,1,#VALUE!,MCV,8,-36.9740505,149.921774,31,27/01/2022,2022,1,27,27,1
MCV-35,35,,1,#VALUE!,MCV,8,-36.9740505,149.921774,31,27/01/2022,2022,1,27,27,1
MCV-36,36,,1,#VALUE!,MCV,8,-36.9740505,149.921774,31,27/01/2022,2022,1,27,27,1
MCV-37,37,,1,#VALUE!,MCV,8,-36.9740505,149.921774,31,27/01/2022,2022,1,27,27,1
MCV-38,38,,-1,#VALUE!,MCV,8,-36.9740505,149.921774,31,27/01/2022,2022,1,27,27,1
MCV-39,39,,1,#VALUE!,MCV,8,-36.9740505,149.921774,31,27/01/2022,2022,1,27,27,1
MCV-4,4,?,1,#VALUE!,MCV,NA5,-36.1555,150.00963,162,23/01/2022,2022,1,23,23,1
MCV-40,40,,1,#VALUE!,MCV,10,-37.342491,149.734026,106,28/01/2022,2022,1,28,28,1
MCV-41,41,,1,#VALUE!,MCV,10,-37.342491,149.734026,106,28/01/2022,2022,1,28,28,1
MCV-42,42,,1,#VALUE!,MCV,10,-37.342491,149.734026,106,28/01/2022,2022,1,28,28,1
MCV-43,43,,1,#VALUE!,MCV,10,-37.3232786,149.7325735,119,28/01/2022,2022,1,28,28,1
MCV-44,44,,1,#VALUE!,MCV,NA1,-37.30886,149.766006,116,28/01/2022,2022,1,28,28,1
MCV-45,45,,1,#VALUE!,MCV,NA1,-37.30886,149.766006,116,28/01/2022,2022,1,28,28,1
MCV-46,46,,-1,#VALUE!,MCV,NA1,-37.30886,149.766006,116,28/01/2022,2022,1,28,28,1
MCV-47,47,,1,#VALUE!,MCV,NA1,-37.2986268,149.7593976,97,28/01/2022,2022,1,28,28,1
MCV-48,48,,1,#VALUE!,MCV,NA1,-37.294153,149.745336,180,28/01/2022,2022,1,28,28,1
MCV-49,49,,1,#VALUE!,MCV,8,-36.9740505,149.921774,31,28/01/2022,2022,1,28,28,1
MCV-5,5,abeona,-1,#VALUE!,MCV,2,-35.56004,150.36372,76,23/01/2022,2022,1,23,23,1
MCV-50,50,,1,#VALUE!,MCV,8,-36.9740505,149.921774,31,28/01/2022,2022,1,28,28,1
MCV-51,51,,-1,#VALUE!,MCV,8,-36.9740505,149.921774,31,28/01/2022,2022,1,28,28,1
MCV-52,52,,1,#VALUE!,MCV,8,-36.9740505,149.921774,31,28/01/2022,2022,1,28,28,1
MCV-53,53,,1,#VALUE!,MCV,8,-36.9740505,149.921774,31,28/01/2022,2022,1,28,28,1
MCV-54,54,,1,#VALUE!,MCV,9,-37.1134174,149.9507169,67,29/01/2022,2022,1,29,29,1
MCV-55,55,,1,#VALUE!,MCV,9,-37.1134174,149.9507169,67,29/01/2022,2022,1,29,29,1
MCV-56,56,,1,#VALUE!,MCV,9,-37.1134174,149.9507169,67,29/01/2022,2022,1,29,29,1
MCV-57,57,,1,#VALUE!,MCV,9,-37.1134174,149.9507169,67,29/01/2022,2022,1,29,29,1
MCV-58,58,,1,#VALUE!,MCV,9,-37.1134174,149.9507169,67,29/01/2022,2022,1,29,29,1
MCV-59,59,,1,#VALUE!,MCV,9,-37.1134174,149.9507169,67,29/01/2022,2022,1,29,29,1
MCV-6,6,abeona,1,#VALUE!,MCV,2,-35.56004,150.36372,76,23/01/2022,2022,1,23,23,1
MCV-60,60,,-1,#VALUE!,MCV,NA1,-37.30001,149.761944,84,29/01/2022,2022,1,29,29,1
MCV-61,61,,-1,#VALUE!,MCV,NA1,-37.30001,149.761944,84,29/01/2022,2022,1,29,29,1
MCV-62,62,,1,#VALUE!,MCV,10,-37.342491,149.734026,106,29/01/2022,2022,1,29,29,1
MCV-63,63,,1,#VALUE!,MCV,10,-37.342491,149.734026,106,29/01/2022,2022,1,29,29,1
MCV-64,64,,-1,#VALUE!,MCV,10,-37.342491,149.734026,106,29/01/2022,2022,1,29,29,1
MCV-65,65,,1,#VALUE!,MCV,10,-37.3466546,149.7272054,132,29/01/2022,2022,1,29,29,1
MCV-66,66,,1,#VALUE!,MCV,10,-37.3479036,149.7219238,166,29/01/2022,2022,1,29,29,1
MCV-67,67,,1,#VALUE!,MCV,10,-37.3479036,149.7219238,166,29/01/2022,2022,1,29,29,1
MCV-68,68,,1,#VALUE!,MCV,10,-37.3479036,149.7219238,166,29/01/2022,2022,1,29,29,1
MCV-69,69,,1,#VALUE!,MCV,9,-37.1134174,149.9507169,67,30/01/2022,2022,1,30,30,1
MCV-7,7,abeona,1,#VALUE!,MCV,2,-35.56004,150.36372,76,23/01/2022,2022,1,23,23,1
MCV-70,70,,-1,#VALUE!,MCV,7,-36.692119,149.9931192,29,30/01/2022,2022,1,30,30,1
MCV-71,71,,1,#VALUE!,MCV,NA2,-35.5704469,150.2972217,98,31/01/2022,2022,1,31,31,1
MCV-72,72,,1,#VALUE!,MCV,2,-35.56004,150.36372,76,31/01/2022,2022,1,31,31,1
MCV-73,73,,1,#VALUE!,MCV,2,-35.56004,150.36372,76,31/01/2022,2022,1,31,31,1
MCV-74,74,,1,#VALUE!,MCV,2,-35.56004,150.36372,76,31/01/2022,2022,1,31,31,1
MCV-75,75,,1,#VALUE!,MCV,2,-35.56004,150.36372,76,31/01/2022,2022,1,31,31,1
MCV-76,76,,1,#VALUE!,MCV,2,-35.56004,150.36372,76,31/01/2022,2022,1,31,31,1
MCV-77,77,,1,#VALUE!,MCV,2,-35.56004,150.36372,76,31/01/2022,2022,1,31,31,1
MCV-78,78,,1,1,MCV,1,-35.4368541,150.3758587,96,21/02/2022,2022,2,21,52,-1
MCV-79,79,,1,2,MCV,1,-35.4368541,150.3758587,96,21/02/2022,2022,2,21,52,-1
MCV-8,8,abeona,-1,#VALUE!,MCV,2,-35.56004,150.36372,76,23/01/2022,2022,1,23,23,1
MCV-80,80,,-1,1,MCV,1,-35.4368541,150.3758587,96,21/02/2022,2022,2,21,52,-1
MCV-81,81,,1,2,MCV,1,-35.4368541,150.3758587,96,21/02/2022,2022,2,21,52,-1
MCV-82,82,,1,1,MCV,1,-35.4368541,150.3758587,96,21/02/2022,2022,2,21,52,-1
MCV-83,83,,-1,2,MCV,1,-35.4368541,150.3758587,96,21/02/2022,2022,2,21,52,-1
MCV-84,84,,1,1,MCV,1,-35.4368541,150.3758587,96,21/02/2022,2022,2,21,52,-1
MCV-85,85,,1,2,MCV,3,-35.6768205,150.1550533,95,22/02/2022,2022,2,22,53,-1
MCV-86,86,,1,1,MCV,NA4,-35.842419,150.1122921,76,22/02/2022,2022,2,22,53,-1
MCV-87,87,,1,2,MCV,4,-36.0225142,150.0853651,76,23/02/2022,2022,2,23,54,-1
MCV-88,88,,1,1,MCV,4,-36.0225142,150.0853651,76,23/02/2022,2022,2,23,54,-1
MCV-89,89,,1,2,MCV,4,-36.0225142,150.0853651,76,23/02/2022,2022,2,23,54,-1
MCV-9,9,abeona,-1,#VALUE!,MCV,2,-35.56004,150.36372,76,23/01/2022,2022,1,23,23,1
MCV-90,90,,1,1,MCV,4,-36.0225142,150.0853651,76,23/02/2022,2022,2,23,54,-1
MCV-91,91,,1,2,MCV,4,-36.0225142,150.0853651,76,23/02/2022,2022,2,23,54,-1
MCV-92,92,,1,1,MCV,4,-36.0225142,150.0853651,76,23/02/2022,2022,2,23,54,-1
MCV-93,93,,1,2,MCV,4,-36.0225142,150.0853651,76,23/02/2022,2022,2,23,54,-1
MCV-94,94,,1,1,MCV,7,-36.6920198,149.99065,48,24/01/2022,2022,1,24,24,1
MCV-95,95,,1,2,MCV,7,-36.6920198,149.99065,48,24/01/2022,2022,1,24,24,1
MCV-96,96,,1,1,MCV,7,-36.6920198,149.99065,48,24/01/2022,2022,1,24,24,1
MCV-97,97,,1,2,MCV,7,-36.6920198,149.99065,48,24/01/2022,2022,1,24,24,1
MCV-98,98,,1,1,MCV,7,-36.6920198,149.99065,48,24/01/2022,2022,1,24,24,1
MCV-99,99,,1,2,MCV,7,-36.6920198,149.99065,48,24/01/2022,2022,1,24,24,1
